Date,Newspaper,Headline,News
28-Sep-18,City AM,Not hitting the right note: Shares dip as DCC announces Jam Group deal,"IRELAND-BASED DCC plans to buy Canada-based musical instruments distributor Jam Group for an enterprise value of $170m (£129.4m), the company said yesterday, as it continues to diversify its business through acquisitions. Shares closed down more than four per cent. DCC also said it planned to place up to 8.9m new shares with institutional investors and use the proceeds to drive its acquisition strategy. DCC said its first-half profit would be in line with its expectations, helped by acquisitions. DCC said its group operating profit would be well ahead of the prior year, driven by acquisitions completed in the prior year, and that trading across each division was also in line with expectations. ""The acquisition of Jam significantly strengthens DCC Technology's position in the North American market,"" chief executive Donal Murphy said in a statement. In February, DCC bought Elite One Source Nutritional Services marking its entry into the US healthcare market. DCC made its first acquisition outside its core markets in April 2017 when it agreed to buy Shell's liquefied petroleum gas unit in Hong Kong and Macau."
27-Sep-18,City AM,TP Icap unveils Square Mile headquarters,"THE WORLD'S largest interdealer broker yesterday revealed plans to move into a major new City headquarters in Broadgate, in an effort to house all of its brokers under one roof following the firm's merger in 2016. TP Icap will take up four floors of 135 Bishopsgate in a leasing that will see the FTSE 250 firm cover 123,000 square feet of office space. The move comes as the brokerage company, which merged the two firms of Tullett Prebon and Icap in 2016, looks to amalgamate its two current City offices around Liverpool Street. In recent months TP Icap has made similar such decisions across the world, having already signed commercial leases to move staff into new and bigger offices in cities such as Singapore, Sydney and New York. Yesterday's announcement is also a major coup for British Land, the property firm developing Broadgate, which has been making efforts to lure in major names to its mixed-use site since its makeover in the last decade. It is thought the move will happen in the spring of 2020 following a radical refurbishment of the building. Nicolas Breteau, boss of TP Icap, said: ""This is great news for our London-based employees, who will benefit from the excellent facilities available at 135 Bishopsgate. Our new headquarters reflect the ambition we have for our business and will provide an environment in which our competing brands will continue to thrive. It is also an important landmark in the group's integration as we reduce our global footprint of offices."" David Lockyer, head of Broadgate for British Land, said: ""The quality of Broadgate's offering and the service we provide here has been a key driver in TP Icap's decision to remain at the campus."""
26-Sep-18,City AM,Comcastacquires 30 per cent of Sky,"US MEDIA titan Comcast yesterday confirmed it had bought 30 per cent of shares in British broadcaster Sky so far after winning a dramatic auction for the company against 21st Century Fox on Saturday. Comcast told the market it had purchased 515,885,170 shares at its improved offer price of 1,728p per share. Sky investors have until 11 October to accept Comcast's bid, which it tabled when it beat Rupert Murdoch's Fox at the highly unusual auction last weekend. Sky's Independent Committee has already declared Comcast's offer as ""materially superior"" and strongly advised its investors to accept it immediately. Fox improved its 1,400p per share offer to 1,567p, but it was not enough to beat Comcast's bid, which values Sky at more than £30bn. It spoiled the party for Murdoch and Fox, which was looking to acquire the 61 per cent stake of Sky it does not already own. It's still unclear what Disney, which will soon own Fox's media assets including its Sky stake, will do with its holdings in the media firm. Sky shares jumped on Monday after news of Comcast's win, and are now trading around 1,726p, just below its offer price."
25-Sep-18,City AM,Comcast shares tank as news of £30bn Sky deal hits Wall Street,"MEDIA giant Comcast's share price yesterday suffered its worst day on the stock market in nine years, falling as much as eight per cent as investors feared the firm had overpaid in its acquisition of pay-TV giant Sky. In a conclusion to the heated corporate bidding war that lasted almost two years, the US cable television provider outbid rival 21st Century Fox in an auction over the weekend to close with a total offer of £30.6bn for control of Sky. The final offer came in at 1,728p per share from Comcast after three rounds of bidding in the UK's largest ever auction process by deal size, beating out Fox's offer of 1,567p. The deal makes Comcast the world's largest paid-for TV operator with roughly 52m customers. Sky shares, on the other hand, flew up almost nine per cent in trading yesterday. The firm's independent board called the auction ""an excellent outcome"", and urged shareholders to accept the deal immediately. CMC Markets chief analyst David Madden called the deal ""a good fit"", with the new group to be a ""truly global player"" in the years to come."
25-Sep-18,City AM,Barrick Gold in $18bn merger with Randgold,"TWO OF the world's largest gold producers are set to merge as Canada's Barrick Gold said it has agreed to buy London-listed Randgold Resources in a shock $18bn (£13.7bn) deal. In plans to create what Barrick Gold and Randgold Resources hailed as an ""industry-leading gold company"", the companies will be hoping to cement their footprints in most of North America and Africa after a challenging year for both firms. It would be the world's biggest gold miner with a value of about $18bn. Barrick, which has suffered a dip in outfall, will own around two-thirds of the new company while Randgold, which has been hit by a strike at one of its biggest mines, will own around a third. Mark Bristow, chief executive of Randgold, will become president and chief executive of the New Barrick Group. In a joint statement the companies yesterday said: ""The boards of Barrick and Randgold believe that the merger will create an industry-leading gold company with the greatest concentration of tier one gold assets in the industry, the lowest total cash cost position among senior gold peers."" A number of gold producers have struggled in the last year, with the growing strength of the US dollar making the commodity much more expensive for foreign buyers. Randgold shares on the London Stock Exchange will be cancelled and New Barrick Group will be listed in Toronto and New York, operating under the branding of the Barrick Group. Barclays and CIBC advised on the deal for Randgold and Morgan Stanley and M. Klein and Co. acted as advisers for Barrick."
24-Sep-18,Tech Crunch,Uber and Grab hit with $9.5M in fines over ‘anti-competitive’ merger,Uber and Grab have been hit with combined fines of $9.5 million after their merger deal was found to have violated Singapore’s anti-competition laws.
20-Sep-18,Tech Crunch,"Adobe gets its company, snaring Marketo for $4.75 billion","A week ago rumors were flying that Adobe would be buying Marketo , and lo and behold it announced today that it was acquiring the marketing automation company for $4.75 billion."
20-Sep-18,Tech Crunch,MariaDB acquires Clusterix,"MariaDB , the company behind the eponymous MySQL drop-in replacement database, today announced that it has acquired Clusterix , which itself is a MySQL drop-in replacement database, but with a focus on scalability. MariaDB will integrate …"
20-Sep-18,City AM,Sainsbury's and Asda merger to be investigated,"A PROPOSED merger of retail giants Sainsbury's and Asda will receive further scrutiny after the Competition and Markets Authority (CMA) said concerns over the deal merited deeper investigation. The watchdog warned that the two supermarkets currently ""overlap in hundreds of local areas"", meaning shoppers could face higher prices or worse service if the two were to merge, after its phase one investigation found the tie-up ""raises sufficient concerns"" for the probe to continue. ""These concerns will be considered further in the phase two investigation, along with other issues raised so far with the CMA - including those relating to fuel, general merchandise (such as clothing) and increased buyer power over suppliers,"" the CMA said. Sainsbury's wants to acquire its competitor in a £7.3bn deal that would narrow the field of major supermarkets in the UK. Sainsbury's and Asda each hold just over a 15 per cent share of the UK supermarket industry, according to Kantar Worldpanel figures released this month. Combined, the two British supermarkets would command almost £1 in every £3 spent on groceries. Mike Coupe, group chief executive of J Sainsbury, and Roger Burnley, president and chief executive of Asda, said: ""We expected the CMA would want to undertake an in-depth review and look forward to engaging with the CMA and panel on this next phase of the process."" The CMA's second phase will see its independent panel members gather evidence through customer surveys, discussions with rival retailers, suppliers and industry bodies. The watchdog has said that it would reject any deal that hurt customers. At the time of its launch, Andrea Coscelli, chief executive of the CMA, said: ""About £190bn is spent each year on food and groceries in the UK so it's vital to find out if the millions of people who shop in supermarkets could lose out as a result of this deal."" The CMA has a statutory deadline of 5 March to reach a decision on whether to permit the merger."
19-Sep-18,City AM,Marsh to acquire City insurer JLT in £4.3bn deal,"NEW YORK-HEADQUARTERED Marsh & McLennan agreed to buy UK insurance broker Jardine Lloyd Thompson (JLT) yesterday for £4.3bn. Shares in FTSE 250-listed JLT soared by more than 30 per cent following the announcement. Marsh has offered 1,915p in cash for each JLT share, valuing the business at £4.9bn. The offer represents a premium of 33.7 per cent to the closing price of 1,432p per share on 17 September, the last business day before the deal was announced. JLT shares are currently trading at 1,872p. The boards of both companies have recommended that shareholders accept the offer. Panmure Gordon analyst Barrie Cornes said: ""We view the offer as fabulous for JLT shareholders. Its recent moves into the US has potentially been the trigger for Marsh to make the offer but irrespective of the reason this is a great price."" President and chief executive of Marsh, Dan Glaser, said the deal ""creates a compelling value proposition for our clients, our colleagues and our shareholders"". Marsh said it expects to make savings of $250m (£190m) over three years as a result of the deal. It said this would partly come through job cuts. Marsh said it expects to reduce headcount at the combined group by between two and five per cent. Marsh employs 65,000 people in more than 130 counties while JLT employs 10,000 people worldwide, including 4,000 in the UK. Potential job losses could number up to 3,500. Goldman Sachs is financial adviser to Marsh & McLennan, with Mark Sorrell as UK lead, with Slaughter and May providing legal advice. Financial advisers to JLT are JP Morgan Cazenove, with Conor Hillery leading, and Simon Robertson Associates, with Clifford Chance providing legal advice."
18-Sep-18,City AM,Top pension boss to lead salary takeover fund,"THE FORMER chairman of the Pension Protection Fund (PPF), Lawrence Churchill, was yesterday appointed as the inaugural chairman of emerging consolidator firm Clara Pensions. The industry figure will bring 40 years of experience to the role at the company, which consolidates firms' historic defined benefit pension schemes. Clara says it acts as a ""bridge"" for members from their current company sponsor to the insured market. He will take up the role alongside current positions as chairman of the Pensions Policy Institute and chairman of the Independent Governance Committee for Prudential. Churchill said: ""Spurred on by encouragement from the government, financial consolidation for defined benefit pension schemes has emerged as the newest frontier. ""I am greatly looking forward to helping pioneer what will hopefully become the route of choice for transferring pension savers from their pension scheme to a safer insured future."" Adam Saron, chief exec of Clara, added: ""As a life-long advocate for putting the interests of members and savers above all else, Lawrence truly embodies the member-first spirit on which Clara is built."" It comes as companies, most recently British Airways, look to strike deals to insure their large pension scheme liabilities."
17-Sep-18,City AM,Abu Dhabi Financial Group offers revised bid for Abraaj's ME funds,"ABU DHABI Financial Group (ADFG) has submitted a revised bid to acquire the management rights for the Middle East funds of stricken Dubai-based Abraaj, according to a document seen by Reuters. The Abu Dhabi-based alternative investment firm is among more than 12 bidders seeking to buy most of Abraaj's private equity funds. However, in a letter to investors in Abraaj Funds, ADFG said that the bid is unlikely to materialise given the ""convolution"" of the situation. To address this, ADFG is seeking a dedicated budget to conduct a full forensic audit and a litigation budget. Its new offer includes up to $6m (£4.6m) for the audit and litigation financing as well as a $10m credit facility to fund the operations of the Middle East funds. The $10m is in addition to $10m earmarked separately for the fund manager's liabilities. ""Such a dedicated budget is crucial not only to seek damages from previous management but also to ensure recoverability of funds for investors in the Middle East funds,"" ADFG said in the letter seen by Reuters. ""This means there is a zero capital call requirement from all the 200 unique investors in the Middle East funds which will clear one of the major hurdles going forward for the protection of the assets."""
13-Sep-18,City AM,Sports Direct AGM fuels Debenhams and House of Frasermerger talk,"THE PROSPECT of a merger between troubled high street giants Debenhams and House of Fraser arose at the annual shareholders' meeting yesterday of retailer Sports Direct, which owns the former and has a major stake in the latter. Debenhams' share price rose nine per cent at the suggestion of a linkup, which came after a question about the idea was put to Sports Direct's senior non-executive director, Simon Bentley. Bentley's reply to the original question from a reporter was: ""It's been discussed,"" Reuters reported. However, Bentley, who announced yesterday he was stepping down from the board along with chairman Keith Hellawell, later denied he had said that. ""I was asked a general question about whether or not we discuss our strategic investments, and in particular Debenhams, to which I replied in the positive,"" he said. ""I made no mention of any merger between House of Fraser and Debenhams, nor did I intend my answer to infer that."" The UK's largest sports-goods retailer Sports Direct International - majority-owned by the colourful chairman of Newcastle United FC Mike Ashley - bought department store chain House of Fraser out of administration in August. The firm already had a 29 per cent stake in the Debenhams store group. Ashley also survived a potential shareholder backlash at the company's AGM yesterday, with just under 10 per cent of investors voting against the re-election of the billionaire retail magnate as chief executive."
13-Sep-18,City AM,IWG financial chief exits after halted takeover,"SHARED office provider IWG said yesterday its chief financial and operating officer Dominik de Daniel will leave the company to pursue other opportunities. The FTSE 250 firm ended speculation over a potential takeover last month, halting talks with suitors and sending shares toppling. The Regus owner said it had appointed Eric Hageman as interim chief financial officer. Hageman has experience as head of finance at a number of listed companies, including TeleCity Group. De Daniel's exit also follows the firm issuing a profit warning in June, saying the cost of new sites and a downturn in its British business due to Brexit uncertainty had hit the company. Doug Sutherland, chairman of IWG, said: ""On behalf of the board I would like to take this opportunity to thank Dominik for his leadership and significant contributions during his time at IWG. ""Completing his third year, Dominik leaves the group with a strong balance sheet to support our growth ambitions."" De Daniel said: ""IWG has a bright future in what has become a hugely exciting growth sector. IWG's market-leading position, unique national networks and global footprint, coupled with recent investments, will allow the group to further realise its full potential."""
11-Sep-18,Tech Crunch,Twilio’s contact center products just got more analytical with Ytica acquisition,"Twilio , a company best known for supplying a communications APIs for developers has a product called Twilio Flex for building sophisticated customer service applications on top of Twilio’s APIs. Today, it announced it was acquiring Ytica …"
10-Sep-18,Tech Crunch,Zendesk expands into CRM with Base acquisition,"Zendesk has mostly confined itself to customer service scenarios, but it seems that’s not enough anymore. If you want to truly know the customer behind the interaction, you need a customer system of record to go with the customer service …"
10-Sep-18,Tech Crunch,Intel acquires NetSpeed Systems to boost its system-on-a-chip business,"Intel today is announcing another acquisition as it continues to pick up talent and IP to bolster its next generation of computing chips beyond legacy PCs. The company has acquired NetSpeed Systems , a startup that makes system-on-chip …"
7-Sep-18,City AM,Melrose swings to loss after £8bn GKNacquisition,"MELROSE recorded a half-year loss following its acquisition of GKN but said it had found ""no black holes"" in the engineering giant it bought for £8.1bn in April. The turnaround company reported a statutory loss of £303m for the six months ending 30 June - compared with a pre-tax profit of £48m in the same period last year. Melrose said the aerospace and automotive business was meeting the board's expectations and that significant progress had already made. It said all GKN businesses were being managed successfully on a standalone basis, freed from head office bureaucracy, with improvement plans in place. Chairman Christopher Miller said: ""Plans have been agreed and are now being implemented to realise the full potential of GKN's world leading, but currently underdeveloped, businesses."" Those plans include a new global technology centre for aerospace in the UK, improving GKN's automotive factories in Europe and adding an engine repair facility in Asia. It also confirmed plans to explore strategic options for GKN's powder metallurgy business. GKN makes components for Boeing and Airbus and its Driveline business is used by the likes of Ford and Jaguar Land Rover."
6-Sep-18,City AM,CITY MOVES WHO'S SWITCHING JOBS,"FINANCIAL CONDUCT AUTHORITY The Financial Conduct Authority (FCA) has appointed Sheldon Mills as its new director of competition. Sheldon is currently senior director, mergers and state aid at the Competition and Markets Authority (CMA). At the CMA, Sheldon has overall leadership responsibility for the delivery of UK merger control across the entire economy and for the strategic design and implementation of the new UK State Aid regime. Sheldon was appointed senior director of mergers in 2014, having first held a senior directorship in 2013 at the Office of Fair Trading (OFT), the CMA's predecessor. Sheldon is a qualified solicitor and, before joining the OFT in 2010, practised competition and anti-trust law at City firms, SJ Berwin, Jones Day and K&L Gates. Sheldon is a trustee at Stonewall, the LGBT+ support and advocacy charity. JCDECAUX AIRPORT UK JCDecaux UK announces the appointment of Arianne Riddell as sales director of JCDecaux Airport, the UK's number one airport advertising company. Arianne joins from LinkedIn where she was global agency lead. Reporting to Alan Sullivan, managing director of JCDecaux Airport, Riddell will head the team responsible for commercial strategy and partnerships at Heathrow, Heathrow rail and Edinburgh airport. With 20 years' experience in the industry, Riddell has over seven years of digital and B2B expertise from LinkedIn across roles spanning the UK, EMEA and global markets. Prior to this she held roles at companies including: BBC Worldwide, H Bauer and We R Interactive. She will work to bring increased value to clients, agencies and specialists through ever more effective campaigns and strategic partnerships. HOWARD KENNEDY Law firm Howard Kennedy has strengthened its capital markets offering following the hire of corporate expert, James Wilson, into the partnership. With many years of experience in advising nomads and companies on the Alternative Investment Market (Aim), James has been hired to lead the Aim team at Howard Kennedy. James joins the firm from the corporate department of Holman Fenwick Willan (HFW), where he specialised in corporate finance transactions, M&A and a range of other corporate and commercial work across a broad range of sectors. Prior to that he was at Reed Smith where he primarily advised a variety of issuers, investors and intermediaries on floats, secondary offerings and takeovers. He brings with him extensive experience having advised on the recent Aim floats of Angling Direct, Filta Group, Comptoir Group, Everyman Media Group and Elegant Hotels Group."
3-Sep-18,City AM,HNA Group cuts debt by £9bn in sell-off spree,"CHINA'S HNA Group reduced its debt load in the first half of 2018 as the company sold off assets acquired under a high-profile acquisition spree helmed by its former chairman, according to the company's latest financial report. HNA Group's total debt stood at 657.41bn yuan (£74.3bn) at the end of the first half, down 10.7 per cent or $11.6bn (£9bn) from the end of 2017. Despite the reduction, the group's total debt to earnings before interest, tax, depreciation and amortisation ratio was 21.36 times at the end of the first half. The company reported a first-half net profit of 1.3bn yuan. HNA's push to sell off assets follows a $50bn spree led by former cochairman Wang Jian that saw HNA accumulate assets ranging from a stake in Deutsche Bank to highprofile overseas properties. The firm has faced scrutiny over the complex structures used to hold the stakes, including in Germany's biggest bank. Wang died during a business trip in France on 3 July. The conglomerate has since sold off many of those assets under pressure from Beijing, amid broader concerns over debt levels in the Chinese private sector. China's clampdown on aggressive overseas deals has also seen the likes of Dalian Wanda Group offloading billions of dollars worth of assets last year, while Anbang Insurance Group was taken over by the government this year. In early August, HNA Group announced a management reshuffle, in a move to calm worries about leadership at the conglomerate. An aviation-to-financial services conglomerate that counts Hainan Airlines as its core asset, HNA's recent sales include holdings in companies such as Hilton Worldwide Holdings, Park Hotels & Resorts and Spain's NH Hotels."
3-Sep-18,City AM,The Hut Group spurns offers as spree continues,"ONLINE beauty and lifestyle retail company The Hut Group (THG) has rebuffed a series of takeover deals as it looks to expand its own acquisition spending spree, according to reports. A number of offers valuing the firm at almost £4bn have been turned away by the fast-growing technology company, Sky News reported last night. While strategic and financial buyers hoping to snap up THG have been rejected, Sky News also said the e-commerce giant will announce it has bought beauty product maker Acheson & Acheson for between £50m and £100m later this week. The deal is said to add another 380 staff to THG's 3,000-strong workforce, which is expected to double by next year. The reports of further expansion plans come a month after THG secured more than $1bn (£771m) from banks to bolster its overseas growth by buying up more beauty and wellbeing businesses. In 2017 the firm spent more than £160m on strategic deals as part of a plan to widen its portfolio of brands, including skincare brand Espa and make-up business Illamasqua. With brands ranging from sports nutrition supplement Myprotein to haircare product maker Grow Gorgeous, the Manchester-based business is regularly on bankers' lists as a potential candidate for floating. Last year it reported a 47 per cent rise in sales over 12 months, with higher profits spurred by demand throughout international markets, particularly in the US. THG boss Matthew Moulding told Sky News the Acheson & Acheson deal was a ""truly exciting addition"" and ""one that uniquely positions THG to make a step-change in its innovation, operational excellence and manufacturing capacity""."
