Date,Newspaper,Headline,News
15-May-18,City AM,Platinum miner cutting spending as takeover nears,"PLATINUM mining giant Lonmin yesterday announced it will cut spending and job roles after net cash fell 77 per cent, but said it still set to be bought by Sibanye-Stillwater. The company's net cash decreased from $75m (£55m) last March to only $17m in the six months to 31 March, it said in results out yesterday. While the total tonnes of platinum mined was only marginally down from last year, with a 1.1 per cent decrease, the company was particularly affected by lower platinum prices. As a result of the loss, Lonmin said it will cut its annual spending target, which will include letting go of 1,504 company employees. The company's share price rose 7.44 per cent by the close, to 52.15p. Lonmin, which is the world's third largest producer of platinum, said because of the difficult operating environment caused by the low platinum prices, it may have to continue to cut spending. It added that this could affect 12,600 jobs over the next three years on top of the redundancies it has already had to make. Sibanye-Stillwater, the company seeking to take over Lonmin, has said that it will walk away from the deal if it turns out that Lonmin does not have the net cash required when the deal is set to close later this year. Nevertheless, Lonmin has said that the takeover is set to continue as planned. The offer made by Sibanye-Stillwater of a £285m takeover is yet to be approved by both companies' shareholders and is still awaiting approval from both the UK and South African competition authorities before Lonmin can go ahead with the takeover. Chief executive of Lonmin, Ben Magara, said: ""The Lonmin team remains focused on operational excellence, and dealing successfully with tougher conditions that currently face our entire industry. ""As is typical of transactions of this nature [Sibanye-Stillwater deal], our focus remains on minimising disruption to the business as we move towards completion. We have to remain cash vigilant in order to maintain a resilient business, ready for the next era."""
15-May-18,City AM,IWG share price leaps 20pc after takeover talks,"SHARES in serviced office firm International Workplace Group (IWG) jumped more than 22 per cent yesterday after it was revealed that the company was in talks for a full-share takeover. The company confirmed on Friday that it had interest from three separate private equity firms: Lone Star, Starwood Capital and TDR Capital over the potential sale. ""The board is evaluating the possible offers with its financial advisers and shareholders will be updated in due course,"" the statement explained. A FTSE 250-listed company, IWG is valued at around £2.1bn and posted profits of £149.4m last year. However, a profit warning last year led to a takeover attempt from Canadian property group Brookfield, though the £2.4bn bid was eventually rejected. Lone Star, Starwood and TDR will now have until 8 June to announce a firm offer or drop their bid for a takeover. The company has faced increased competition from flexible office space companies like WeWork and UK startup The Office Group. Announcing its first-quarter results earlier this month, the company said that it would ""continue to invest in our national networks to maintain our clear industry leadership""."
9-May-18,City AM,Watchdog turns up the heat on Npower-SSE deal,"THE UK'S competition authority has said it will launch a full investigation into the proposed merger of energy firms Npower and SSE, after they failed to address concerns about the impact on competition and prices for consumers. The firms announced a deal in November in which Britain's second-largest supplier, SSE, would merge and spin off its household energy and supply business to create an independent supplier with Innogy's Npower. Last month the Competition and Markets Authority (CMA) said the deal ""warrants further scrutiny"". Yesterday the watchdog said neither firm had been able to offer measures to address its concerns, and so it has referred the merger for a more in-depth investigation. A decision on the merger will now be made by a group of independent panel members supported by CMA staff. The deadline for the final report is 22 October. The energy market has already been in the spotlight over a lack of competition following an in-depth report by the CMA which said customers were paying £1.4bn more than they would in a fully competitive market. The government is poised to introduce a price cap on default energy tariffs as early as Christmas in a bid to tackle what it calls a ""broken"" market."
9-May-18,City AM,The future of UK supermarkets is big data and personalisation,"THE PROPOSED merger of two supermarket giants, Asda and Sainsbury's, has been hailed as one of the new ""forces of UK retail"". But in a rush to point out that the combined chain would have nearly a third of the UK supermarket sector, one key factor has been ignored: Amazon. Amazon recently launched its online grocery delivery service. Known for its speed, convenience and ease of use, we expect many shoppers to flock to the ecommerce behemoth as commonplace for their weekly shop in the near future. And who knows, maybe it won't be long before Facebook and Google move into the supermarket space. When heading to a competitor's website is as easy as an app download away, traditional supermarkets need to innovate to retain their competitive edge. The question for Sainsbury's and Asda is how do two very different brands still keep the customer at the heart of the shopping experience, and compete with ecommerce giants that have personalisation and big data use literally coded into their business models? Out of the UK chains, Sainsbury's has led the way in adopting and embracing a highly consumer-centric approach, while Asda's strategy has focused on driving costs down and passing the price benefit to the customer. Will we now see a cross-pollination of ideas resulting in a superior customer experience at an unbeatable value, or will the new venture react to the threat by the budget chains Aldi and Lidl to become a highly cost-focused organisation? While it might be tempting to go for the latter and slash costs, the former is where the true value lies. Retaining a competitive edge today is all about understanding customer triggers, using insights and big data. Gaining a deeper understanding of customer demands, and mining data across the wave of digital channels, is imperative to delivering a personalised experience. Amazon has spent decades perfecting this, and has a substantial headstart on the big retails chains. This isn't just about pouring resources into websites. Physical stores will continue to drive forward a significant portion of supermarket revenue, and delivering a customised experience cannot be overlooked here either. Earlier this year, the opening of Amazon's first physical store demonstrated how retailers can disrupt the traditional bricks and mortar approach, enhancing rather than replacing them. In the Amazon store, smart cameras and sensors observed what customers put in their baskets and charged them directly on their accounts, with no need for checkouts. This may seem like a gimmick, but making innovative use of emerging technologies, including artificial intelligence (AI) and the internet of things (IoT), is crucial for the retail sector. If supermarkets want to keep up with the competition, this must be a cornerstone of their approach, in order to minimise supply chain costs, and make more insightful decisions for the benefit of their customers. AI is not something to be feared. It may lead to job replacement, but in retail it can be a real force for good in decision making and the customer journey mapping process. AI technology, combined with smart sensors and the IoT, will also play an integral role in automating the supply chain, improving store efficiencies, and reducing operating costs. It is partly down to this technology that Amazon is able to provide such a personalised service, while keeping costs so low. The merger of Asda and Sainsbury's spells big news for the retail sector, but we should not become fixated on whether having one fewer supermarket brand means less consumer choice. Rather, this is about the opportunity to offer customers a more personalised experience. If the combined chain can put consumer needs first, harness technology, and focus on designing the right store experience, the merger will be a force to reckon with against the online challenger brands. The future for UK supermarkets is bright - but the opportunities need to be grasped with open arms, now. Simply merging isn't enough. £ Anil Gandharve is head of retail, CPG and Manufacturing at Mindtree. Amazon has spent decades perfecting this, and has a substantial headstart"
3-May-18,City AM,Sainsbury's Asda deal - in the money or in jeopardy?,"CITY TALK PARTNER CONTENT Matthew West discusses the possible effects between the merger between superstores Sainsbury's and Asda INFINOX TALK In the pantheon of ""I didn't realise that microphone was on"" gaffes, it was up near Gordon Brown's disastrous - some say election-losing - shocker in 2010. This week the chief executive of Sainsbury's, Mike Coupe, was caught on tape singing ""We're in the Money"" in between a round of media interviews that had been called for him to announce the retail giant's plans to merge with its rival Asda. On the face of it, Mr Coupe had good reason to be cheerfully singing away. He is in the money. As a major shareholder in Sainsbury's, he saw the value of his shareholding in the firm he runs leap just over 20 per cent on Monday compared with Friday's closing price. UK markets clearly warmed to news of the takeover. In the US however, Asda's parent company, Wal-Mart, saw its share price rise by a far more modest 2 per cent in the first half hour of trading on Wall Street on Monday. Evidence perhaps that Asda means somewhat less across the Atlantic than it does here in Britain, particularly given Wal-Mart will retain a very significant 43 per cent shareholding in Asda. GOOD DEAL FOR WAL-MART We were told on Monday that the £10bn merger would create a combined group worth £5.9bn, making it bigger than Tesco - the current market leader - with a 31 per cent market share. Mr Coupe would become group chief executive (CEO) but Asda would retain its CEO and continue to be run from Leeds. Staff and customers alike were assured there would be no store closures and no job cuts, and that prices in both Asda and Sainsbury stores would come down by 10 per cent on average. So what's not to like? Well, for Wal-Mart nothing, Asda is a good business to get rid of. It's been a bit of an albatross around the US giant's neck in recent years. That's in part as a result of the need to squeeze margins thanks to what are disparagingly described as the discount grocers Aldi and Lidl. Sainsbury's, Tesco and Morrison have all also been under huge pressure in recent years for the same reason. And let's not forget that Sainsbury's bought home retailer Argos two years ago for £1.4bn, in part as a way of combating the threat from Amazon, which has begun to make inroads into the grocery business. ATTACK IS THE BEST FORM OF DEFENCE Mergers and acquisitions (M&A) are usually illustrative of one of two things. More often than not they are a signal that a market sector is consolidating in order for some companies to grow and to pull in expertise. Those businesses with pots of cash buy up smaller rivals because they like their business and the rival perhaps does something a bit better than they themselves do, so will add value to their company. But M&A activity can also be a sign of weakness and self-defence. Is that what is happening here? There's no doubt that together Asda and Sainsbury's can cut costs, even if that doesn't mean staff or stores. The combined group's market share will enable it to tighten the screws on suppliers and drive down their prices - which seems inevitable, regardless of Mr Coupe's assurances to the contrary. To what extent such savings will be passed on to the consumer is another matter too. These were among the points made by Charles Newsome, division director at Investec Wealth and Investment on Monday and it is probably a view shared by other market analysts. Moreover, it is hard to believe there will be no job losses or store closures, particularly if you consider that in many towns Sainsbury's and Asda stores are but a stone's throw from one another and retail space is awfully expensive these days. Then there is the issue of competition. The way the deal is structured, Sainsbury's will probably get it past the Competition and Markets Authority (CMA) and consolidation in the grocery market is nothing new either. But in essence Britain will be left with just three big supermarkets - one of which was looking decidedly wobbly a year or two ago - regardless of the brands that may still exist. That's almost certainly an undesirable state of affairs. Matthew West, Contributing Editor for Infinox Capital READ MORE ONLINE Read more at: cityam.com/infinox Staff and customers were assured there wouldn't be any closures or job cuts"
3-May-18,City AM,Megadeals help UK buck falling M&A in Europe,"UK COMPANIES received more investment through announced mergers and acquisitions (M&A) than any of their western European peers in April, and are set to rake in €58.4bn (£42.8bn) - the largest monthly value for the country since July 2016. Comcast's eventual £22bn formal bid for Sky topped the deal rankings, while Sainsbury's offer to buy Asda for £7.3bn closed the month in a strong second place, according to research from Moody's analytics company Bureau van Dijk. Yet the number of deals announced across western Europe fell to a low not seen in more than a year, and private equity and venture capital (PE and VC) interest in the region also decreased. Though the UK is often Europe's largest private equity market, it only saw western Europe's fifth largest private equity-backed deal in April as Goldman Sachs and Antin Infrastructure took on Cityfibre. ""Despite the disappointing result in terms of deal values across both M&A and PE and VC deals over the fourweek period, there have been a number of sizeable deals announced during April with all of the top 20 M&A deals by value exceeding €1bn,"" said Bureau van Dijk director Lisa Wright. ""This shows there is a substantial appetite for deal making in western Europe as we move into the second quarter."" While the UK led western Europe in terms of overall announced M&A value, Germany led by volume of deals. Its businesses featured in 425 deals, ahead of the UK's 379, while both Germany and Spain managed to get into the double figures in terms of deal value with €24.6bn and €15bn respectively. Although private equity interest in western Europe appeared to take a breather in April, data released yesterday from trade body Invest Europe showed last year was strong. Private equity investment in European companies hit a 10-year high of €71.7bn in 2017, a 29 per cent increase year-on-year, while almost 7,000 companies received funding. France and Benelux-based companies received 27 per cent of private equity investments in 2017, closely followed by the UK & Ireland with 26 per cent. Funds raised by European private equity houses hit €91.9bn, the highest amount since 2008 and surpassing the previous year by 12 per cent."
3-May-18,City AM,Gresham House scoops up forestry investor for £25m,"ALTERNATIVE asset manager Gresham House yesterday made its largest acquisition ever, grabbing forestryand renewables-focused investment house FIM for up to £25m. FIM had £893m in assets under management, bringing Gresham's total to more than £1.5bn. Gresham House, which will continue to focus on forestry, new energy, UK housing and infrastructure, private assets and strategic public equity, will initially pay £21m for the business. This will include £11.2m of cash and £9.8m of loan notes to be converted into Gresham House shares. A further £4m will be paid if performance conditions are met by two years after the deal. Gresham's chief executive Anthony Dalwood said the deal would help it become a leader in UK commercial forestry. The deal is Gresham's third in as many years, and helped the firm's share price rise by almost three per cent yesterday. Gresham, which is listed on London's junior Alternative Investment Market, also announced it would raise up to £15m to help finance the deal by placing new shares. Any leftover cash could be used for more acquisitions, the company said. The firm's current shareholders include names such as the Berkshire Pension Fund, Majedie, River & Mercantile, Saffie Investments (the family office of private equity veteran Damon Buffini), Charles Stanley and the Alliance Trust."
2-May-18,City AM,T-Mobile's win lifts telco deals to 12-year high,"THE VALUE of global telco mergers and acquisition activity hit its highest in 12 years thanks to T-Mobile's mammoth $59bn (£43bn) bid for Sprint. News of the deal was announced on Sunday, marking the end of four years of back-and-forth between the two companies. The new enterprise will most likely be called T-Mobile and be run under the company's chief executive John Legere. Data released yesterday by Thomson Reuters showed that the deal was big enough to push global telco mergers and acquisitions up to a value of $107.6bn from 223 transactions during 2018. It also revealed that the T-Mobile Sprint deal is the eighth largest telecom transaction on record, and the biggest since Verizon's $130.3bn acquisition of Verizon Wireless in 2013, the second biggest telco deal of all time. The biggest deal of all time remains Vodafone Air Touch's friendly merger with Mannesmann in 1999, where the British telco purchased the firm for around £202.8bn (adjusted for today's currency rates). Guy Peddy, telecoms analyst at Macquarie Group said: ""Clearly, operators are looking for scale ahead of the 5G roll out so mergers and acquisitions are an inevitable way to increase their networks and reach."" But Peddy reckoned the figures would probably not be beaten in 2019. ""The deal between Sprint and T-Mobile US is one of the biggest possible intra-sector deals we've seen so these figures inflate the overall stats looking into 2019,"" he added. The new company formed by the TMobile deal will be worth a combined total of $146bn, enabling the firm to branch into the emerging 5G market. Last year, a report by law firm Baker McKenzie and consultants Oxford Economics estimated that total global mergers and acquisition activity would reach $3.2 trillion in 2018, as dealmaking lifts on an economic tide. In February, research based around lawyers' preparations predicted mergers and acquisitions would grow 10 per cent in the first half of 2018."
2-May-18,City AM,How would a potential merger affect Asda and Sainsbury's?,"EARLIER this week grocery giants Asda and Sainsbury's sent shockwaves through the retail industry as they announced merger plans. If the proposal is successful, the new organisation could overtake Tesco as the UK's largest retailer. There are some obstacles to clear before the merger is confirmed of course. The Competition and Markets Authority will have to review the deal and there are also questions about how the move would work in practical terms. But from a consumer perspective, YouGov BrandIndex shows that there is already some crossover of current customers of both supermarkets. Of those who have shopped at Asda within the past month, 37 per cent say they have also shopped at Sainsbury's in that time. Among the general public, Sainsbury's already has relatively strong brand health. Its most recent quality score sits at 44 and purchase consideration at 43. However, its value score is far lower at nine - less than half of Asda's score (23). Looking at a long-term analysis of the brands, the data shows that, as Sainsbury's has seen a gradual decline across several metrics over the past three years, Asda has seen an increase in some. While Sainsbury's has built its reputation on its quality offering to middleclass shoppers, Asda has been known for everyday low prices. While that remains the case, both have come under pressure from discounters Aldi and Lidl, two brands that have surpassed expectations and gained increased market share. Our data indicates that it is not just those on lower incomes that have been drawn to the German stores. Among those who say they earn at least £50,000 a year, Aldi's purchase consideration score (whether someone would consider buying from the brand) has climbed from 26 to 37 over the past two years. Despite Sainsbury's shoppers looking for quality, YouGov Profiles data reinforces the need for a good value offering, with 71 per cent of those who shop in Sainsbury's and 78 per cent of those who choose Asda saying they are usually looking for the lowest prices when they go shopping. While the merger will need work in terms of the overall brand architecture, there is great potential for the move to work if customers benefit from both companies' core offering. £ Stephan Shakespeare is the chief executive of YouGov"
27-Apr-18,City AM,New suitors wait in the wings for Norwegian Air,"NORWEGIAN Air Shuttle yesterday admitted it has received ""several inquiries"" following IAG's acquisition of 4.6 per cent of its shares, causing its board to bring in financial advisors to handle the situation. The company revealed the news while unveiling its financial results for the first quarter of this year. ""Norwegian has received several inquiries following IAG Group's announcement of its acquisition of 4.6 per cent of the shares in the company,"" it said. Net profit losses narrowed to 46.2m krone (£4.17m) this year, from 1.4bn krone the previous quarter. The reduction in losses was helped by the fact Norwaybased bank Norwegian Finans Holding injecting 1.9bn krone into the airline, but losses before interest and taxes amounted to 2.2bn krone. Its revenue grew to 7bn krone. The airline increased its passenger numbers by 12 per cent to 7.5m in the first quarter, translating to capacity growth of 36 per cent and a load factor of 84.5 per cent. IAG confirmed earlier this month that it was mulling a full offer for low-cost carrier Norwegian, after picking up 4.6 per cent stake in the airline."
25-Apr-18,City AM,Takeda-Shire deal could be confirmed today,"deal that could be announced as early as today. Takeda made a fresh approach for the London-listed business yesterday, sending shares up by six per cent, with investors expecting Takeda's fifth approach to be sweeter than the £44bn cash and shares offer tabled with Shire's board on 20 April. Shire is expected to agree to an extension of today's regulatory deadline which requires Takeda to make a firm approach to shareholders by 5pm. The breathing space will allow Takeda to carry out more due diligence and solidify its offer. Takeda and Shire did not immediately respond to requests for comment last night. The Irish-headquartered firm announced the latest approach unilaterally yesterday before Takeda confirmed it later in the day. Last week, Botox maker Allergan attempted to gatecrash Takeda's pursuit of Shire with its own offer. Allergan has until 17 May to make a formal approach to shareholders. In a bizarre U-turn Allergan ruled itself out just hours after revealing an interest in the FTSE 100 firm. Shire had previously rejected Takeda's approaches in what would be the biggest overseas acquisition by a Japanese company. At the firm's annual general meeting yesterday Shire chair Susan Kilsby said: ""Discussions between the advisers of Shire and Takeda are ongoing."""
25-Apr-18,City AM,PSA's revenue soars after Opel acquisition,"REVENUE at Peugeot and Citroen owner PSA grew by 42 per cent in the first quarter, largely thanks to last year's acquisition of Opel Vauxhall. Sales were up more than 44 per cent, including Opel Vauxhall, with PSA selling over 1m vehicles. Revenue was pushed up to €18.2bn (£16bn) from €12.7m the previous quarter. At a constant 2015 exchange rate, group revenue for 2018 was up over 21 per cent. The Citroen division saw its revenue increase by 13.3 per cent. Opel Vauxhall's automotive division was worth €4.8bn. The figures come at an interesting time for PSA, which bought the rival European operations of Vauxhall's European parent General Motors last year in a merger valued at £1.9bn. Since then, there have been pressures to close Vauxhall's plant in Ellesmere Port, where 250 jobs were cut in 2015. PSA chairman Carlos Tavares has said the firm may hold back investment in the Ellesmere Port factory until after a Brexit trade deal is finalised. It is seeking to cut 650 jobs. Earlier this month, Vauxhall launched a consultation with its dealers around the country about plans to consolidate sites as it battles with tough conditions for the car industr y. Boosting profitability has become a key concern of car makers in the UK, with falling car sales driven by the drop in demand for diesel alongside structural changes to the way in which consumers buy cars with the rise of the internet and personal contract purchases. PSA's 'Push to Pass' plan, which excludes Opel Vauxhall, aims to deliver over 4.5 per cent automotive recurring operating margins in 2016-2018 and deliver 10 per cent group revenue growth by 2018 vs 2015. Jean-Baptiste de Chatillon, chief financial officer of Groupe PSA and member of the managing board, said ""Push to Pass strategic plan and Opel Vauxhall turnaround plan are on track to make this strong performance a solid basis for the future."""
